{
  "partner": {
    "id": "22222222-2222-4222-8222-222222222222",
    "organizationId": "11111111-1111-4111-8111-111111111111",
    "legalName": "Zakaznik Demo s.r.o.",
    "displayName": "Zakaznik Demo",
    "ico": "87654321",
    "dic": "2198765432",
    "icDph": "SK2198765432",
    "country": "SK",
    "partnerType": "customer",
    "language": "SK",
    "defaultDueDays": 14,
    "defaultCurrency": "EUR",
    "note": null,
    "createdAt": "2026-01-02T09:00:00Z",
    "updatedAt": "2026-01-02T09:00:00Z"
  },
  "addresses": [
    {
      "addressType": "registered",
      "street": "Hlavna",
      "streetNumber": "1",
      "city": "Bratislava",
      "postalCode": "81101",
      "country": "SK"
    }
  ],
  "contacts": [
    {
      "contactType": "billing_email",
      "name": "Fakturacia",
      "email": "fakturacia@example.test",
      "phone": null,
      "isPrimary": true
    }
  ],
  "bankAccounts": [],
  "taxIds": [
    {
      "type": "ico",
      "value": "87654321",
      "country": "SK",
      "verifiedAt": null
    },
    {
      "type": "dic",
      "value": "2198765432",
      "country": "SK",
      "verifiedAt": null
    },
    {
      "type": "ic_dph",
      "value": "SK2198765432",
      "country": "SK",
      "verifiedAt": null
    }
  ],
  "riskFlags": [],
  "documentSnapshot": {
    "legalName": "Zakaznik Demo s.r.o.",
    "displayName": "Zakaznik Demo",
    "ico": "87654321",
    "dic": "2198765432",
    "icDph": "SK2198765432",
    "address": {
      "addressType": "registered",
      "street": "Hlavna",
      "streetNumber": "1",
      "city": "Bratislava",
      "postalCode": "81101",
      "country": "SK"
    },
    "country": "SK",
    "capturedAt": "2026-01-02T09:00:00Z"
  }
}
